<?xml version="1.0" encoding="UTF-8"?>
<!DOCTYPE order_Items SYSTEM "order_Items.dtd">
<order_Items>
    <order_Item>
        <order_id>1</order_id>
        <recipe_id>101</recipe_id>
        <quantity>2</quantity>
        <price>10.99</price>
    </order_Item>
    <order_Item>
        <order_id>1</order_id>
        <recipe_id>102</recipe_id>
        <quantity>1</quantity>
        <price>8.50</price>
    </order_Item>
    <order_Item>
        <order_id>2</order_id>
        <recipe_id>103</recipe_id>
        <quantity>3</quantity>
        <price>15.75</price>
    </order_Item>
</order_Items>
